{
  "schema_version": "1.1",
  "title": "示例城市两日行程",
  "overview": "首日抵达后慢逛，次日午休后返程。",
  "budget_note": "两人总预算1500元，不含往返车票。下述费用预留为预算分配上限，不是真实报价。",
  "days": [
    {
      "date": "2030-05-01",
      "label": "第1天",
      "theme": "抵达与慢逛",
      "items": [
        {
          "time_text": "14:00–15:00",
          "title": "前往住宿区域",
          "category": "transport",
          "location": "示例城市站 → 住宿区域",
          "duration_text": null,
          "description": "乘公共交通从示例城市站前往住宿区域。",
          "cost_text": "车费待确认。",
          "notes": [
            "交通耗时待核实；此时段为预留时段，不代表已核实耗时。"
          ]
        },
        {
          "time_text": "15:30–17:00",
          "title": "示例博物馆",
          "category": "activity",
          "location": "示例博物馆",
          "duration_text": "约90分钟",
          "description": null,
          "cost_text": "门票价格待核实。",
          "notes": [
            "地址、开放时间及预约要求待确认。"
          ]
        },
        {
          "time_text": "18:00–19:00",
          "title": "晚餐",
          "category": "meal",
          "location": "住宿区域",
          "duration_text": null,
          "description": "在住宿区域用餐。",
          "cost_text": "两人预留150元，仅为预算分配上限，非餐厅报价。",
          "notes": [
            "饮食禁忌与餐厅信息待确认。"
          ]
        }
      ]
    },
    {
      "date": "2030-05-02",
      "label": "第2天",
      "theme": "午休与返程",
      "items": [
        {
          "time_text": "午后",
          "title": "午休 / 自由活动",
          "category": "rest",
          "location": null,
          "duration_text": null,
          "description": "午休或自行活动，不安排额外景点。",
          "cost_text": null,
          "notes": [
            "具体地点与时长未明确。"
          ]
        },
        {
          "time_text": "14:30–16:00",
          "title": "返程",
          "category": "transport",
          "location": "住宿区域 → 示例城市站",
          "duration_text": null,
          "description": "从住宿区域前往示例城市站，16:00离开。",
          "cost_text": "车费待确认。",
          "notes": [
            "此时段为返程预留，实际交通耗时待确认。"
          ]
        }
      ]
    }
  ],
  "preparation": {
    "clothing": [
      {
        "title": "衣物",
        "body": "按个人需要带薄外套，天气待出发前复查。"
      }
    ],
    "accommodation": [
      {
        "title": "住宿",
        "body": "具体酒店与房价待确认。"
      }
    ]
  },
  "pending_items": [
    "示例博物馆的门票、地址、开放时间与预约要求待确认。",
    "交通耗时与车费待确认。",
    "餐厅与饮食禁忌待确认。",
    "具体酒店与房价待确认。"
  ],
  "risks": [
    "交通资料未核实，出发前复查。"
  ],
  "weather": []
}
